{
  "$schema": "../recipe.schema.json",
  "schemaVersion": 1,
  "number": 2,
  "status": "published",
  "chapter": "type",
  "order": 10,
  "level": 3,
  "genres": ["paper"],
  "outputs": ["canvas", "pdf"],
  "features": {
    "primary": ["math", "heading-numbering"],
    "also": [
      "opener-design", "span-boxes", "chips", "figure-citations", "unnumbered-headings", "heading-styles",
      "opener-band", "heading-attributes", "figure-numbering", "float-placement",
      "super-subscripts", "captions", "table-style", "paragraph-styles", "resources",
      "bibliography", "pdf-export"
    ]
  },
  "answers": ["Q48", "Q49", "Q32", "Q40", "Q63"],
  "gaps": [],
  "gotchas": [
    "math-bundle",
    "dollar-math"
  ],
  "explainsWarnings": ["invalidMath", "unclosedMath"],
  "related": [
    "lab-report-formulas",
    "thesis-back-matter",
    "endnotes-instead-of-footnotes",
    "technical-datasheet"
  ],
  "workarounds": [],
  "engine": { "postext": "1.34.0", "postextPdf": "1.34.0", "math": true },
  "kit": ["core", "fonts", "viewer", "pdf", "images"],
  "sample": { "locales": ["en"] },
  "capture": {
    "hero": 1,
    "card": "crop",
    "focus": { "page": 1, "x": 0.01, "y": 0, "w": 0.98, "h": 0.52 },
    "expect": { "pages": [4, 4] }
  },
  "downloads": { "pdf": true },
  "folio": {
    "paper": {"type": "coatedMatte", "grammage": 90},
    "binding": {"type": "saddleStitch", "cover": "pages"},
    "surface": {"type": "plain", "color": "#dfe7e3"},
    "lighting": {"environment": "studio"}
  },
  "credits": {
    "authors": [{ "name": "Ignacio Ferro", "github": "drnachio" }],
    "text": [],
    "images": [],
    "fonts": [
      { "family": "STIX Two Text", "license": "OFL-1.1" },
      { "family": "Schibsted Grotesk", "license": "OFL-1.1" },
      { "family": "Azeret Mono", "license": "OFL-1.1" }
    ]
  },
  "license": { "code": "MIT", "content": "CC-BY-4.0" },
  "created": "2026-09-25",
  "updated": "2026-10-16"
}
