{
  "$schema": "../recipe.schema.json",
  "schemaVersion": 1,
  "number": 46,
  "status": "published",
  "chapter": "running-heads",
  "order": 20,
  "level": 3,
  "genres": ["manual"],
  "outputs": ["canvas"],
  "features": {
    "primary": ["bleed-bands", "section-running-heads", "emphasis-colours"],
    "also": [
      "heading-styles", "opener-design", "design-anchoring", "design-images", "heading-attributes",
      "paragraph-styles", "bibliography", "page-role-filters", "running-heads", "column-rule",
      "column-balancing", "widows-orphans-runts", "hyphenation-languages", "color-palette",
      "page-background", "mirrored-margins", "resources"
    ]
  },
  "answers": ["Q83", "Q40", "Q50", "Q30", "Q31"],
  "gotchas": [
    "section-last-wins", "style-inherits-break", "header-paints-over-text",
    "negative-offsets"
  ],
  "related": ["thesis-back-matter", "anchoring-cheat-sheet", "parts-in-colour"],
  "workarounds": [
    { "followup": "EF-60", "package": "postext", "note": "the letter styles set no breakBefore and inherit level 1's disabled break, so B and C open mid-column; a letter that should open a page needs its own breakBefore on its style" }
  ],
  "engine": { "postext": "1.57.0" },
  "kit": ["core", "fonts", "viewer", "images"],
  "sample": { "locales": ["en", "es"] },
  "capture": {
    "hero": [2, 3],
    "card": "crop",
    "focus": { "page": 3, "x": 0.494, "y": 0.0269, "w": 0.506, "h": 0.2846 },
    "pages": "all",
    "expect": { "pages": [4, 4] }
  },
  "folio": {
    "paper": {"type": "bible", "grammage": 50, "shade": "#fdfdfb"},
    "binding": {"type": "hardcover", "cover": "case", "coverMaterial": "cloth", "coverColor": "#1f3a5f"},
    "surface": {"type": "walnut"},
    "lighting": {"environment": "lamp"}
  },
  "credits": {
    "authors": [{ "name": "Ignacio Ferro", "github": "drnachio" }],
    "text": [
      {
        "what": { "en": "The Sailor’s Word-Book (London: Blackie and Son, 1867), entries from A, B and C", "es": "The Sailor’s Word-Book (Londres: Blackie and Son, 1867), entradas de la A, la B y la C" },
        "who": "W. H. Smyth; Sir Edward Belcher",
        "source": "https://www.gutenberg.org/ebooks/26000",
        "license": "PD"
      },
      {
        "what": { "en": "Spanish translation, editor’s note and colophon", "es": "Traducción al español, nota del editor y colofón" },
        "who": "Postext Cookbook",
        "license": "original"
      }
    ],
    "images": [],
    "fonts": [
      { "family": "Alegreya", "license": "OFL-1.1" },
      { "family": "Alegreya SC", "license": "OFL-1.1" },
      { "family": "Alegreya Sans SC", "license": "OFL-1.1" }
    ]
  },
  "license": { "code": "MIT", "content": "CC-BY-4.0" },
  "created": "2026-09-26",
  "updated": "2026-10-22"
}
